Enter password: ****
Welcome to the MySQL monitor.  Commands end with ; or \g.
Your MySQL connection id is 59
Server version: 8.0.32 MySQL Community Server - GPL

Copyright (c) 2000, 2023, Oracle and/or its affiliates.

Oracle is a registered trademark of Oracle Corporation and/or its
affiliates. Other names may be trademarks of their respective
owners.

Type 'help;' or '\h' for help. Type '\c' to clear the current input statement.

mysql> create database payroll_service_database;
Query OK, 1 row affected (0.01 sec)

mysql> show databases;
+--------------------------+
| Database                 |
+--------------------------+
| 07_dec                   |
| 14july                   |
| 30dec23_bridgelabz       |
| baner                    |
| db1                      |
| demodb                   |
| dtodb                    |
| employ                   |
| employee                 |
| employyee_db             |
| hefshine                 |
| hibernate                |
| hostel                   |
| hotel_db                 |
| information_schema       |
| many2                    |
| manyone                  |
| mapping                  |
| mydatabase               |
| mynewdb                  |
| mysql                    |
| mysql1                   |
| new_schema               |
| newprojectdb             |
| one                      |
| onetomany                |
| payroll_service_database |
| performance_schema       |
| practice                 |
| procedure_schema         |
| septprojectbatch         |
| septtest                 |
| songcurd                 |
| spring_practicedb        |
| springsat                |
| student                  |
| sys                      |
| test1                    |
+--------------------------+
38 rows in set (0.01 sec)

mysql> use payroll_service_database;
Database changed
mysql> create table employee_payroll(id int auto_increment primary key, name varchar(50), salary double, startDate date);
Query OK, 0 rows affected (0.03 sec)

mysql> select * from employee_payroll;
Empty set (0.00 sec)

mysql> insert into employee_payroll values (1,"Suraj",10000,'2000-09-20');
Query OK, 1 row affected (0.01 sec)

mysql> select * from employee_payroll;
+----+-------+--------+------------+
| id | name  | salary | startDate  |
+----+-------+--------+------------+
|  1 | Suraj |  10000 | 2000-09-20 |
+----+-------+--------+------------+
1 row in set (0.00 sec)

mysql>  insert into employee_payroll values (2,"Swapnil",15000,'2020-10-22');
Query OK, 1 row affected (0.00 sec)

mysql> select * from employee_payroll;
+----+---------+--------+------------+
| id | name    | salary | startDate  |
+----+---------+--------+------------+
|  1 | Suraj   |  10000 | 2000-09-20 |
|  2 | Swapnil |  15000 | 2020-10-22 |
+----+---------+--------+------------+
2 rows in set (0.00 sec)

mysql>  insert into employee_payroll values (3,"sumit",17000,'2023-11-09');
Query OK, 1 row affected (0.00 sec)

mysql>  select * from employee_payroll;
+----+---------+--------+------------+
| id | name    | salary | startDate  |
+----+---------+--------+------------+
|  1 | Suraj   |  10000 | 2000-09-20 |
|  2 | Swapnil |  15000 | 2020-10-22 |
|  3 | sumit   |  17000 | 2023-11-09 |
+----+---------+--------+------------+
3 rows in set (0.00 sec)

mysql> select * from employee_payroll;
+----+---------+--------+------------+
| id | name    | salary | startDate  |
+----+---------+--------+------------+
|  1 | Suraj   |  10000 | 2000-09-20 |
|  2 | Swapnil |  15000 | 2020-10-22 |
|  3 | sumit   |  17000 | 2023-11-09 |
+----+---------+--------+------------+
3 rows in set (0.00 sec)

mysql>  insert into employee_payroll values (4,"vivek",45500,'2024-10-10');
Query OK, 1 row affected (0.01 sec)

mysql> select * from employee_payroll;
+----+---------+--------+------------+
| id | name    | salary | startDate  |
+----+---------+--------+------------+
|  1 | Suraj   |  10000 | 2000-09-20 |
|  2 | Swapnil |  15000 | 2020-10-22 |
|  3 | sumit   |  17000 | 2023-11-09 |
|  4 | vivek   |  45500 | 2024-10-10 |
+----+---------+--------+------------+
4 rows in set (0.00 sec)

mysql> select * from employee_payroll where name = "sumit";
+----+-------+--------+------------+
| id | name  | salary | startDate  |
+----+-------+--------+------------+
|  3 | sumit |  17000 | 2023-11-09 |
+----+-------+--------+------------+
1 row in set (0.00 sec)

mysql> select * from employee_payroll where startDate between Cast ('2017-09-10' as date) and date(now());
ERROR 1584 (42000): Incorrect parameters in the call to stored function `Cast`
mysql>  select * from employee_payroll where startDate between Cast('2017-09-10' as date) and date(now());
+----+---------+--------+------------+
| id | name    | salary | startDate  |
+----+---------+--------+------------+
|  2 | Swapnil |  15000 | 2020-10-22 |
|  3 | sumit   |  17000 | 2023-11-09 |
+----+---------+--------+------------+
2 rows in set (0.00 sec)

mysql>  select * from employee_payroll where startDate between Cast('2020-10-09' as date) and date(now());
+----+---------+--------+------------+
| id | name    | salary | startDate  |
+----+---------+--------+------------+
|  2 | Swapnil |  15000 | 2020-10-22 |
|  3 | sumit   |  17000 | 2023-11-09 |
+----+---------+--------+------------+
2 rows in set (0.00 sec)

mysql> alter table employee_payroll add gender varchar(20);
Query OK, 0 rows affected (0.02 sec)
Records: 0  Duplicates: 0  Warnings: 0

mysql> select * from employee_payroll;
+----+---------+--------+------------+--------+
| id | name    | salary | startDate  | gender |
+----+---------+--------+------------+--------+
|  1 | Suraj   |  10000 | 2000-09-20 | NULL   |
|  2 | Swapnil |  15000 | 2020-10-22 | NULL   |
|  3 | sumit   |  17000 | 2023-11-09 | NULL   |
|  4 | vivek   |  45500 | 2024-10-10 | NULL   |
+----+---------+--------+------------+--------+
4 rows in set (0.00 sec)

mysql> update employee_payroll set gender='Male' where name='sumit' or name='suraj';
Query OK, 2 rows affected (0.01 sec)
Rows matched: 2  Changed: 2  Warnings: 0

mysql>  select * from employee_payroll;
+----+---------+--------+------------+--------+
| id | name    | salary | startDate  | gender |
+----+---------+--------+------------+--------+
|  1 | Suraj   |  10000 | 2000-09-20 | Male   |
|  2 | Swapnil |  15000 | 2020-10-22 | NULL   |
|  3 | sumit   |  17000 | 2023-11-09 | Male   |
|  4 | vivek   |  45500 | 2024-10-10 | NULL   |
+----+---------+--------+------------+--------+
4 rows in set (0.00 sec)

mysql> select * from employee_payroll;
+----+---------+--------+------------+--------+
| id | name    | salary | startDate  | gender |
+----+---------+--------+------------+--------+
|  1 | Suraj   |  10000 | 2000-09-20 | Male   |
|  2 | Swapnil |  15000 | 2020-10-22 | NULL   |
|  3 | sumit   |  17000 | 2023-11-09 | Male   |
|  4 | vivek   |  45500 | 2024-10-10 | NULL   |
+----+---------+--------+------------+--------+
4 rows in set (0.00 sec)

mysql> select sum(salary) from employee_payroll where gender='Male' group by gender;
+-------------+
| sum(salary) |
+-------------+
|       27000 |
+-------------+
1 row in set (0.00 sec)

mysql> select avg() from employee_payroll;
ERROR 1064 (42000): You have an error in your SQL syntax; check the manual that corresponds to your MySQL server version for the right syntax to use near ') from employee_payroll' at line 1
mysql>  select avg(salary) from employee_payroll;
+-------------+
| avg(salary) |
+-------------+
|       21875 |
+-------------+
1 row in set (0.00 sec)

mysql> select max(salary) from employee_payroll;
+-------------+
| max(salary) |
+-------------+
|       45500 |
+-------------+
1 row in set (0.00 sec)

mysql> select count(salary) from employee_payroll;
+---------------+
| count(salary) |
+---------------+
|             4 |
+---------------+
1 row in set (0.00 sec)

mysql>  select sum(salary) from employee_payroll where gender='Male' group by gender;
+-------------+
| sum(salary) |
+-------------+
|       27000 |
+-------------+
1 row in set (0.00 sec)

mysql>  select gender,sum(salary) from employee_payroll where gender='Male' group by gender;
+--------+-------------+
| gender | sum(salary) |
+--------+-------------+
| Male   |       27000 |
+--------+-------------+
1 row in set (0.00 sec)

mysql> alter table employee_payroll add employee_phone int(10),add employee_address varchar(100) set default_value 'Mumbai',employee_Department varchar(50)
not null;
ERROR 1064 (42000): You have an error in your SQL syntax; check the manual that corresponds to your MySQL server version for the right syntax to use near 'set default_value 'Mumbai',employee_Department varchar(50) not null' at line 1
mysql>  alter table employee_payroll add employee_phone int(10),add employee_address varchar(100) set default_value 'Mumbai',employee_Department varchar(50)

    -> not null;
ERROR 1064 (42000): You have an error in your SQL syntax; check the manual that corresponds to your MySQL server version for the right syntax to use near 'set default_value 'Mumbai',employee_Department varchar(50)
not null' at line 1
mysql> alter table employee_payroll add employee_phone int(12),add employee_address varchar(100) default 'Mmubai',,employee_Department varchar(50) not null;

ERROR 1064 (42000): You have an error in your SQL syntax; check the manual that corresponds to your MySQL server version for the right syntax to use near ',employee_Department varchar(50) not null' at line 1
mysql>  alter table employee_payroll add employee_phone int(12),add employee_address varchar(100) default 'Mumbai',employee_Department varchar(50) not null;

ERROR 1064 (42000): You have an error in your SQL syntax; check the manual that corresponds to your MySQL server version for the right syntax to use near 'employee_Department varchar(50) not null' at line 1
mysql> alter table employee_payroll
    -> add employee_phone int(10),
    -> add employee_address varchar(100) default 'Pune'
    -> add employee_department varchar(100) not null;
ERROR 1064 (42000): You have an error in your SQL syntax; check the manual that corresponds to your MySQL server version for the right syntax to use near 'add employee_department varchar(100) not null' at line 4
mysql>  alter table employee_payroll
    -> add employee_phone int(10),
    -> add employee_address varchar(100) default 'Pune',
    -> add employee_department varchar(100) not null;
Query OK, 0 rows affected, 1 warning (0.02 sec)
Records: 0  Duplicates: 0  Warnings: 1

mysql> select * from employee_payroll;
+----+---------+--------+------------+--------+----------------+------------------+---------------------+
| id | name    | salary | startDate  | gender | employee_phone | employee_address | employee_department |
+----+---------+--------+------------+--------+----------------+------------------+---------------------+
|  1 | Suraj   |  10000 | 2000-09-20 | Male   |           NULL | Pune             |                     |
|  2 | Swapnil |  15000 | 2020-10-22 | NULL   |           NULL | Pune             |                     |
|  3 | sumit   |  17000 | 2023-11-09 | Male   |           NULL | Pune             |                     |
|  4 | vivek   |  45500 | 2024-10-10 | NULL   |           NULL | Pune             |                     |
+----+---------+--------+------------+--------+----------------+------------------+---------------------+
4 rows in set (0.00 sec)

mysql> alter table salary rename to basicPay
    -> exit
    ->  alter table salary rename to basicPay;
ERROR 1064 (42000): You have an error in your SQL syntax; check the manual that corresponds to your MySQL server version for the right syntax to use near 'exit
 alter table salary rename to basicPay' at line 2
mysql> ^C
mysql>  alter table salary rename to basicPay;
ERROR 1146 (42S02): Table 'payroll_service_database.salary' doesn't exist
mysql> alter table employee_payroll salary rename to basicPay;
ERROR 1064 (42000): You have an error in your SQL syntax; check the manual that corresponds to your MySQL server version for the right syntax to use near 'salary rename to basicPay' at line 1
mysql> alter table employee_payroll rename column to salary to basicPay;
ERROR 1064 (42000): You have an error in your SQL syntax; check the manual that corresponds to your MySQL server version for the right syntax to use near 'to salary to basicPay' at line 1
mysql>  alter table employee_payroll rename column salary to basicPay;
Query OK, 0 rows affected (0.02 sec)
Records: 0  Duplicates: 0  Warnings: 0

mysql> select * from employee_payroll;
+----+---------+----------+------------+--------+----------------+------------------+---------------------+
| id | name    | basicPay | startDate  | gender | employee_phone | employee_address | employee_department |
+----+---------+----------+------------+--------+----------------+------------------+---------------------+
|  1 | Suraj   |    10000 | 2000-09-20 | Male   |           NULL | Pune             |                     |
|  2 | Swapnil |    15000 | 2020-10-22 | NULL   |           NULL | Pune             |                     |
|  3 | sumit   |    17000 | 2023-11-09 | Male   |           NULL | Pune             |                     |
|  4 | vivek   |    45500 | 2024-10-10 | NULL   |           NULL | Pune             |                     |
+----+---------+----------+------------+--------+----------------+------------------+---------------------+
4 rows in set (0.00 sec)

mysql> alter table employee_payroll add deduction double,
    -> taxablePay double,
    -> IncomeTax double,
    -> NetPay double;
ERROR 1064 (42000): You have an error in your SQL syntax; check the manual that corresponds to your MySQL server version for the right syntax to use near 'taxablePay double,
IncomeTax double,
NetPay double' at line 2
mysql> alter table employee_payroll add deduction double,
    -> add  taxablePay double,
    -> add  IncomeTax double,
    -> add  NetPay double;
Query OK, 0 rows affected (0.01 sec)
Records: 0  Duplicates: 0  Warnings: 0

mysql> select * from employee_payroll;
+----+---------+----------+------------+--------+----------------+------------------+---------------------+-----------+------------+-----------+--------+
| id | name    | basicPay | startDate  | gender | employee_phone | employee_address | employee_department | deduction | taxablePay | IncomeTax | NetPay |
+----+---------+----------+------------+--------+----------------+------------------+---------------------+-----------+------------+-----------+--------+
|  1 | Suraj   |    10000 | 2000-09-20 | Male   |           NULL | Pune             |                     |      NULL |       NULL |      NULL |   NULL |
|  2 | Swapnil |    15000 | 2020-10-22 | NULL   |           NULL | Pune             |                     |      NULL |       NULL |      NULL |   NULL |
|  3 | sumit   |    17000 | 2023-11-09 | Male   |           NULL | Pune             |                     |      NULL |       NULL |      NULL |   NULL |
|  4 | vivek   |    45500 | 2024-10-10 | NULL   |           NULL | Pune             |                     |      NULL |       NULL |      NULL |   NULL |
+----+---------+----------+------------+--------+----------------+------------------+---------------------+-----------+------------+-----------+--------+
4 rows in set (0.00 sec)